{
  "artifact_hash": "d9245a5ee77afbf01e49adf1b2cc938e9a297fe1c42d1b89a8595886a8dbbb2b",
  "artifact_policy": {
    "archive_path": "artifacts/release-verification.json",
    "created_after_successful_release_gate": true,
    "fails_when_gate_evidence_commit_mismatch": true,
    "fails_when_gate_evidence_tree_mismatch": true,
    "fails_when_gate_log_integrity_fails": true,
    "fails_when_git_is_dirty_or_unknown": true,
    "fails_when_migration_verification_fails": true,
    "fails_when_production_readiness_contracts_invalid": true,
    "fails_when_production_readiness_is_blocked": true,
    "fails_when_required_gate_evidence_missing": true,
    "records_production_evidence_plan": false,
    "records_production_readiness_contracts": false
  },
  "gate_evidence_file": {
    "commit_matches_current": true,
    "git": {
      "branch": "main",
      "commit": "290b1fa80f1067c7b7d82757ec0a46db61749351",
      "dirty": false,
      "tree": "0c59e852f59e29b9fe9ccc1506aa690b5b53fefc"
    },
    "loaded": true,
    "missing_required_gates": [],
    "path": "artifacts/gate-evidence.json",
    "provenance_valid": true,
    "sha256": "716eea661abc09755ed5e3c45d17c3f0577e4ace2c198f9f4c2a2b0d3c3e0992",
    "tree_matches_current": true
  },
  "gate_summary": {
    "captured_evidence_missing": [],
    "captured_evidence_required": [
      "architecture-baseline-manifest",
      "compose-check",
      "dashboard-browser-verify",
      "dashboard-verify",
      "docker-smoke",
      "engineering-full",
      "engineering-static",
      "etra-check",
      "evolution-check",
      "federation-check",
      "intelligence-check",
      "lint",
      "migration-check",
      "roadmap-sequence-gate",
      "secret-scan",
      "test",
      "typecheck"
    ],
    "execution_model": "Release gates are executed by make check-release before this artifact is written.",
    "failed": 0,
    "passed": 17,
    "total": 17
  },
  "gates": [
    {
      "command": "docker compose config --quiet",
      "evidence": {
        "command": "docker compose config --quiet",
        "duration_seconds": 0.073,
        "executed_before_artifact": true,
        "log_integrity": {
          "actual_sha256": "e3b0c44298fc1c149afbf4c8996fb92427ae41e4649b934ca495991b7852b855",
          "checked": true,
          "valid": true
        },
        "missing_required_evidence": false,
        "output_path": "artifacts/release-gates/compose-check.log",
        "output_sha256": "e3b0c44298fc1c149afbf4c8996fb92427ae41e4649b934ca495991b7852b855",
        "recorded_at": "2026-08-07T14:49:36.746788+00:00",
        "recorded_by": "tools/release_artifact.py",
        "return_code": 0,
        "source": "make check-release dependency",
        "status": "passed"
      },
      "evidence_required": true,
      "name": "compose-check",
      "required": true,
      "status": "passed"
    },
    {
      "command": "alembic heads, upgrade SQL, migration graph verification",
      "evidence": {
        "command": "cd apps/api && .venv/bin/alembic heads && .venv/bin/alembic upgrade head --sql >/dev/null && cd ../.. && python tools/migration_verify.py --json",
        "duration_seconds": 2.633,
        "executed_before_artifact": true,
        "log_integrity": {
          "actual_sha256": "ad2417fb5968c1edcff1881d408f1a6285bc3c3856557de5cab9e4f7131ea350",
          "checked": true,
          "valid": true
        },
        "missing_required_evidence": false,
        "output_path": "artifacts/release-gates/migration-check.log",
        "output_sha256": "ad2417fb5968c1edcff1881d408f1a6285bc3c3856557de5cab9e4f7131ea350",
        "recorded_at": "2026-08-07T14:49:39.379939+00:00",
        "recorded_by": "tools/release_artifact.py",
        "return_code": 0,
        "source": "make check-release dependency",
        "status": "passed"
      },
      "evidence_required": true,
      "name": "migration-check",
      "required": true,
      "status": "passed"
    },
    {
      "command": "cd apps/api && .venv/bin/ruff check src tests ../../migrations",
      "evidence": {
        "command": "cd apps/api && .venv/bin/ruff check src tests ../../migrations",
        "duration_seconds": 0.014,
        "executed_before_artifact": true,
        "log_integrity": {
          "actual_sha256": "82b3e6a6c090a57601d22943bd23fca9218d1031dbe5a7b754092f9a156b4f18",
          "checked": true,
          "valid": true
        },
        "missing_required_evidence": false,
        "output_path": "artifacts/release-gates/lint.log",
        "output_sha256": "82b3e6a6c090a57601d22943bd23fca9218d1031dbe5a7b754092f9a156b4f18",
        "recorded_at": "2026-08-07T14:49:39.394636+00:00",
        "recorded_by": "tools/release_artifact.py",
        "return_code": 0,
        "source": "make check-release dependency",
        "status": "passed"
      },
      "evidence_required": true,
      "name": "lint",
      "required": true,
      "status": "passed"
    },
    {
      "command": "cd apps/api && .venv/bin/mypy src",
      "evidence": {
        "command": "cd apps/api && .venv/bin/mypy src",
        "duration_seconds": 0.769,
        "executed_before_artifact": true,
        "log_integrity": {
          "actual_sha256": "e30256d1ad76ebac1470747a15c97912c5a92a33e6204c9686b11b83cee8136a",
          "checked": true,
          "valid": true
        },
        "missing_required_evidence": false,
        "output_path": "artifacts/release-gates/typecheck.log",
        "output_sha256": "e30256d1ad76ebac1470747a15c97912c5a92a33e6204c9686b11b83cee8136a",
        "recorded_at": "2026-08-07T14:49:40.163751+00:00",
        "recorded_by": "tools/release_artifact.py",
        "return_code": 0,
        "source": "make check-release dependency",
        "status": "passed"
      },
      "evidence_required": true,
      "name": "typecheck",
      "required": true,
      "status": "passed"
    },
    {
      "command": "cd apps/api && .venv/bin/pytest -q",
      "evidence": {
        "command": "cd apps/api && .venv/bin/pytest -q",
        "duration_seconds": 65.623,
        "executed_before_artifact": true,
        "log_integrity": {
          "actual_sha256": "3f71eace83676ae605921e4615207e3d0abd1cf77d3304f3370c2d048fa8c33f",
          "checked": true,
          "valid": true
        },
        "missing_required_evidence": false,
        "output_path": "artifacts/release-gates/test.log",
        "output_sha256": "3f71eace83676ae605921e4615207e3d0abd1cf77d3304f3370c2d048fa8c33f",
        "recorded_at": "2026-08-07T14:50:45.787520+00:00",
        "recorded_by": "tools/release_artifact.py",
        "return_code": 0,
        "source": "make check-release dependency",
        "status": "passed"
      },
      "evidence_required": true,
      "name": "test",
      "required": true,
      "status": "passed"
    },
    {
      "command": "python tools/secret_scan.py --all",
      "evidence": {
        "command": "python tools/secret_scan.py --all",
        "duration_seconds": 1.631,
        "executed_before_artifact": true,
        "log_integrity": {
          "actual_sha256": "4f5e7829a4743f5f157e205f2ed00a8b117d7c32d433d8ded424cbeb50005d97",
          "checked": true,
          "valid": true
        },
        "missing_required_evidence": false,
        "output_path": "artifacts/release-gates/secret-scan.log",
        "output_sha256": "4f5e7829a4743f5f157e205f2ed00a8b117d7c32d433d8ded424cbeb50005d97",
        "recorded_at": "2026-08-07T14:50:47.419164+00:00",
        "recorded_by": "tools/release_artifact.py",
        "return_code": 0,
        "source": "make check-release dependency",
        "status": "passed"
      },
      "evidence_required": true,
      "name": "secret-scan",
      "required": true,
      "status": "passed"
    },
    {
      "command": "python tools/docker_smoke.py --require-worker",
      "evidence": {
        "command": "python tools/docker_smoke.py --require-worker",
        "duration_seconds": 0.21,
        "executed_before_artifact": true,
        "log_integrity": {
          "actual_sha256": "59cdb5e39cd0116f273fdcbdce5adb2a144dcf839b33dcf4c4c4275591c14105",
          "checked": true,
          "valid": true
        },
        "missing_required_evidence": false,
        "output_path": "artifacts/release-gates/docker-smoke.log",
        "output_sha256": "59cdb5e39cd0116f273fdcbdce5adb2a144dcf839b33dcf4c4c4275591c14105",
        "recorded_at": "2026-08-07T14:50:47.628983+00:00",
        "recorded_by": "tools/release_artifact.py",
        "return_code": 0,
        "source": "make check-release dependency",
        "status": "passed"
      },
      "evidence_required": true,
      "name": "docker-smoke",
      "required": true,
      "status": "passed"
    },
    {
      "command": "python tools/architecture_baseline_manifest.py --output artifacts/architecture-baseline-manifest.json",
      "evidence": {
        "command": "python tools/architecture_baseline_manifest.py --output artifacts/architecture-baseline-manifest.json",
        "duration_seconds": 0.215,
        "executed_before_artifact": true,
        "log_integrity": {
          "actual_sha256": "ad180ecc07a792111d89adcf28323540a82a53e2cba01c9f4fc60822495bfeec",
          "checked": true,
          "valid": true
        },
        "missing_required_evidence": false,
        "output_path": "artifacts/release-gates/architecture-baseline-manifest.log",
        "output_sha256": "ad180ecc07a792111d89adcf28323540a82a53e2cba01c9f4fc60822495bfeec",
        "recorded_at": "2026-08-07T14:50:47.844726+00:00",
        "recorded_by": "tools/release_artifact.py",
        "return_code": 0,
        "source": "make check-release dependency",
        "status": "passed"
      },
      "evidence_required": true,
      "name": "architecture-baseline-manifest",
      "required": true,
      "status": "passed"
    },
    {
      "command": "python tools/roadmap_sequence_gate.py --output artifacts/roadmap-sequence-gate.json",
      "evidence": {